361,Dr D Kalyani,"D. Kalyani, Somula Ramasubbareddy, K. Govinda, V. Kumar",,Location-Based Proactive Handoff Mechanism in Mobile Ad Hoc Network,Book Chapter,International Conference on Intelligent Computing and Smart Communication 2019,Yes,Yes,"Algorithms for Intelligent Systems. Springer, Singapore.",2019,December,2018-19,https://link.springer.com/chapter/10.1007/978-981-15-0633-8_9,DOI https://doi.org/10.1007/978-981-15-0633-8_9,ISBN 978-981-15-0632-1,,3,,,,,,,,,,,,,,
362,Dr D Kalyani,"D. Kalyani,Dr R sridevi",,Private Communication Based on Hierarchical Identity-Based Cryptography,Book Chapter,Emerging Technologies in Data Mining and Information Security,Yes,Yes,"Advances in Intelligent Systems and Computing, vol 755. Springer, Singapore.Pages 749-756",2018,December,2018-19,https://link.springer.com/chapter/10.1007/978-981-13-1951-8_67,DOI: https://doi.org/10.1007/978-981-13-1951-8_67,ISBN: 978-981-13-1950-1,,1,,,,,,,,,,,,,,
363,Dr D Kalyani,"Siva santhosh, Kalyani",YES,Secure Encryption scheme with key exchange for Two server Architecture,Journal,IJERCSE,Yes,Yes,"Volume 4, Issue 11,",2017,November,2017-18,https://arxiv.org/ftp/arxiv/papers/1712/1712.04817.pdf,https://arxiv.org/ftp/arxiv/papers/1712/1712.04817.pdf,ISSN : 2394-2320,,,,,,,,,,,,,,,,
364,Dr D Kalyani,Dr. R Sridevi D kalyani,,Robust distributed key issuing protocol for identity based encryption,Conference,"2016 International Conference on Advances in Computing, Communications and Informatics (ICACCI)",Yes,Yes,Pages 821-825 Publisher IEEE,2016,December,2016-17,https://ieeexplore.ieee.org/document/7732147,DOI: 10.1109/ICACCI.2016.7732147,ISBN:978-1-5090-2030-0,,7,,,,,,,,,,,,,,
365,Dr D Kalyani,"Siva santhosh, Kalyani",YES,Elliptical Curve Scalar Multiplication over Pipelined Architecture-GF(2m),Journal,GIJET,Yes,Yes,Volume 7 Issue 1 Pages 79-83,2021,January,2020-21,https://thegrenze.com/index.php?display=page&view=journalabstract&absid=775&id=8,,ISSN : 2395-5295,,,,,,,,,,,,,,,,
366,Dr D Kalyani,Vijay Kumar,,Particle Swarm Based Optimal Key Generation: Block Chain Assisted Secure Information Sharing in Supply Chain Management,Book Chapter,International Conference on Advanced Informatics for Computing Research,Yes,Yes,Volume1,2021,January,2020-21,https://link.springer.com/chapter/10.1007/978-981-16-3660-8_41,https://doi.org/10.1007/978-981-16-3660-8_41,ISBN : 978-981-16-3659-2,,,,,,,,,,,,,,,,
367,Dr D Kalyani,Dr R sridevi,,Robust Distributed key Issuing protocol for Identity based cryptography,Book Chapter,Robust Distributed key Issuing protocol for Identity based cryptography,Yes,Yes,Volume2,2016,September,2016-17,https://ieeexplore.ieee.org/document/7732147,https://doi.org/10.1109/ICACCI.2016.7732147,ISBN:978-1-5090-2030-0,,7,,,,,,,,,,,,,,
368,Dr D Kalyani,"Dasari Kalyani, Putta Srivani, S Pradeep",,Secured information sharing in supply chain management: Modified data sanitization with optimal key generation via hybrid algorithm,Journal,Advances in Engineering Software,-,-,Volume 173 Pages 103-194 Publisher Elsevier,2022,November,2022-23,https://www.sciencedirect.com/science/article/pii/S0965997822001016,https://doi.org/10.1016/j.advengsoft.2022.103194,ISSN / eISSN: 0965-9978 / 1873-5339,,,,,,,,,,,,,,,,
369,Dr D Kalyani,"Harish Kundra, Sudhir Sharma, P Nancy, Dasari Kalyani",,A two level ensemble classification approach to forecast bitcoin prices,Journal,Kybernetes,,,in press Publisher Emerald Publishing Limited,2022,July,2022-23,https://www.emerald.com/insight/content/doi/10.1108/K-11-2021-1213/full/html,https://doi.org/10.1108/K-11-2021-1213,0368-492X,,,,,,,,,,,,,,,,
370,Saritha Vemulapalli,"Saritha Vemulapalli, Shashi Mogalla",No,High Utility-Occupancy Sequential Pattern Mining Algorithm Based On Utility-Occupancy Framework,International Journal,International Journal of Engineering Trends and Technology,Yes,No,"Volume 69 Issue 4, pp: 228-235, April 2021",2021,April,2020-21,http://ijettjournal.org/Volume-69/Issue-4/IJETT-V69I4P231.pdf,10.14445/22315381/IJETT-V69I4P231,2231 – 5381,Scopus,0,,,,,,,,,,,,,,
371,Saritha Vemulapalli,"Saritha Vemulapalli, Shashi Mogalla",No,Pre-Order Post-Order Coded Aggregate Tree based Algorithm for Mining Sequential Patterns,International Journal,International Journal of Engineering and Advanced Technology (IJEAT),yes,No,"Volume 9 Issue 1, pp: 7594 - 7600, Oct 2019",2019,Oct,2019-20,https://www.ijeat.org/wp-content/uploads/papers/v9i1/A2030109119.pdf,10.35940/ijeat.A2030.109119,2249 – 8958,Scopus,0,,,,,,,,,,,,,,
372,Saritha Vemulapalli,"Saritha Vemulapalli, M Shashi",No,Design and Implementation of an Effective Web Server Log Preprocessing System,International Conference,International Conference on Information Systems Design and Intelligent Applications 2012 (INDIA 2012),yes,No,"Advances in Intelligent and Soft Computing book series (AINSC, volume 132, pp: 897-905)",2012,Jan,40878,https://link.springer.com/chapter/10.1007/978-3-642-27443-5_103,https://doi.org/10.1007/978-3-642-27443-5_103,978-3-642-27443-5,Springer / Scopus,5,,,,,,,,,,,,,,
373,V Lavanya,"V. Lavanya, Somula Ramasubbareddy, Govinda. K",,Fuzzy keyword matching using N-Gram and Cryptographic approach over encrypted data in cloud,Book Chapter,Embedded Systems and Artificial Intelligence,Yes,Yes,"Advances in Intelligent Systems and Computing, vol 1076. Springer, Singapore. pp 551-558",2020,April,2019-20,https://link.springer.com/chapter/10.1007/978-981-15-0947-6_52,DOI https://doi.org/10.1007/978-981-15-0947-6_52,ISBN 978-981-15-0946-9,,,,,,,,,,,,,,,,
374,V Lavanya,"Lavanya Vemulapalli, P Chandra Sekhar",,LITERATURE SURVEY ON MACHINE LEARNING BASED TECHNIQUES IN MEDICAL DATA ANALYSIS,Journal,Indian Journal of Applied Research,Yes,Yes,Volume 9 Issue 11,2019,November,2019-20,https://www.doi.org/10.36106/ijar/2113665,https://www.doi.org/10.36106/ijar/2113665,ISSN No. 2249 - 555X,,,,,,,,,,,,,,,,
375,V Lavanya,"Lavanya Vemulapalli, Mohanbabu Choragudi",,Safety Structural Design for Cloud Networking,Journal,International Journal of Conceptions on Computing and Information Technology,Yes,Yes,"Vol. 3, Issue. 1",2015,April,2014-15,http://wairco.org/IJCCIT/April2015.html,http://wairco.org/IJCCIT/April2015.html,ISSN: 2345 – 9808,,,,,,,,,,,,,,,,
376,V Lavanya,"Lavanya Vemulapalli, Mohanbabu Choragudi",,Basic Approaches to Semantic Web Services,Journal,International Journal of Conceptions on Computing and Information Technology,Yes,Yes,"Vol. 3, Issue. 1",2015,April,2014-15,http://wairco.org/IJCCIT/April2015.html,http://wairco.org/IJCCIT/April2015.html,ISSN: 2345 – 9808,,,,,,,,,,,,,,,,
377,V Lavanya,"P SIDDHARTHA, LAVANYA VEMULAPALLI",,EMAIL COMMUNICATION WITH CIRCUMVENTION TOOL,Journal,JES- Journal of Engineering Services,Yes,Yes,"Vol 11, Issue 1, pages 336-341",2020,January,2019-20,https://jespublication.com/upload/2020-1101053.pdf,,ISSN NO:0377-9254,,,,,,,,,,,,,,,,
378,S. Murali Mohan,S. Murali Mohan M.Deepika,Yes,Secured Data Sharing in Group Users in Cloud,Journal,INTERNATIONAL JOURNAL OF RESEARCH IN ELECTRONICS AND COMPUTER ENGINEERING (IJRECE),No,No,Volume 7 Issue 1,2019,March,2018-19,http://nebula.wsimg.com/46d327adb17caf889fa57ed7682e4c47?AccessKeyId=DFB1BA3CED7E7997D5B1&disposition=0&alloworigin=1,,ISSN: 2393-9028,http://www.i2or-ijrece.com/vol.-7-issue-1--version-1-.html,,,,,,,,,,,,,,,
379,Swathi Sambangi,"Illa Pavan Kumar, Swathi Sambangi",No,Automated smart product information management through smart trolley,Journal,International Journal of Mechanical and Production Engineering Research and Development (IJMPERD),yes,,"Vol. 8, Special Issue 2, Nov 2018",2018,November,2018-19,,,ISSN: 2249-8001,,0,,,,,,,,,,,,,,
380,Swathi Sambangi,"Illa Pavan Kumar, Swathi Sambangi",No,Content Based Apparel Recommendation System for Fashion Industry,Journal,International Journal of Engineering and Advanced Technology (IJEAT),yes,,"Volume-8 Issue-6,August 2019 Pages 509-516",2019,August,2019-20,https://www.ijeat.org/wp-content/uploads/papers/v8i6/F7880088619.pdf,DOI: 10.35940/ijeat.F7880.088619,"ISSN: 2249 - 8958,",,2,,,,,,,,,,,,,,
381,Swathi Sambangi,"Illa Pavan Kumar, Swathi Sambangi, Ramasubbareddy Somukoa, Sravani Nalluri, K Govinda",No,Server security in cloud computing using block-chaining technique,Book Chapter,Data Engineering and Communication Technology,yes,,"Vol. 8, Special Issue 2, Nov 2018",2018,November,2018-19,https://link.springer.com/chapter/10.1007/978-981-15-1097-7_77,DOI: https://doi.org/10.1007/978-981-15-1097-7_77,ISSN: 2073-607X,,4,,,,,,,,,,,,,,
382,Swathi Sambangi,"Swathi Sambangi, Lakshmeeswari Gondi",No,Task Scheduling Allocation based on Task Completion Time in Cloud Environment,Journal,International Journal of Recent Technology and Engineering (IJRTE),-,-,"Volume-8 Issue-4,Volume-8 Issue-4,",2019,November,2019-20,https://www.ijrte.org/portfolio-item/D7409118419/,10.35940/ijrte.D7409.118419,,,,,,,,,,,,,,,,,
383,Swathi Sambangi,"K Govinda Illa Pavan Kumar, Swathi Sambangi, Ramasubbareddy Somukoa, Sravani Nalluri",No,Server Security in Cloud Computing Using Block-Chaining Technique,Book Chapter,"Advances in Intelligent Systems and Computing book series (AISC,volume 1079)",,,Pages 913-920,2020,January,2019-20,https://link.springer.com/chapter/10.1007/978-981-15-1097-7_777,https://doi.org/10.1007/978-981-15-1097-7_77,Print ISBN 978-981-15-1096-0,,,,,,,,,,,,,,,,
384,Swathi Sambangi,"Swathi Sambangi, Lakshmeeswari Gondi",No,A machine learning approach for DDoS (distributed denial of service) attack detection using multiple linear regressioN,Journal,Proceedings,,,"63(1), 51;",2020,December,2019-20,https://www.mdpi.com/2504-3900/63/1/51,https://doi.org/10.3390/proceedings2020063051,ISSN 2504-3900,,,,,,,,,,,,,,,,
385,Swathi Sambangi,"Swathi Sambangi, Lakshmeeswari Gondi",No,Multi Linear Regression Model to Detect Distributed Denial of Service Attacks in Cloud Environments,Book Chapter,"Lecture Notes in Electrical Engineering book series (LNEE,volume 788)",,,Innovations in Cyber Physical Systems pp 535–545,2021,September,2021-22,https://link.springer.com/chapter/10.1007/978-981-16-4149-7_48,https://doi.org/10.1007/978-981-16-4149-7_48,Print ISBN 978-981-16-4148-0,,,,,,,,,,,,,,,,
386,Swathi Sambangi,"Swathi Sambangi, Lakshmeeswari Gondi",No,Multiple Linear Regression Prediction Model for DDOS Attack Detection in Cloud ELB,Conferance,ICEMIS'21: The 7th International Conference on Engineering & MIS 2021,,,October 2021 Article No.: 4Pages 1–9,2021,December,2021-22,https://dl.acm.org/doi/abs/10.1145/3492547.3492567,https://doi.org/10.1145/3492547.3492567,ISBN: 978-1-4503-9044-6,,,,,,,,,,,,,,,,
387,Swathi Sambangi,"Swathi Sambangi, Lakshmeeswari Gondi",No,A Feature Similarity Machine Learning Model for DDoS Attack Detection in Modern Network Environments for Industry 4.0,Journal,Computers and Electrical Engineering,,,Volume 100 Pages 107955 Publisher Pergamon,2022,May,2021-22,https://www.sciencedirect.com/science/article/pii/S0045790622002324,https://doi.org/10.1016/j.compeleceng.2022.107955,"ISSN 0045-7906,",,,,,,,,,,,,,,,,
388,B Srivani,"S Renu Deepti B Srivani, N Sandhya",No,Implementation of Power Law Model for Assessing Software Reliability,Book Chapter,Proceedings of the Second International Conference on Computational Intelligence and Informatics,,,"Advances in Intelligent Systems and Computing, vol 712. Springer, Singapore.",2018,July,2017-18,https://link.springer.com/chapter/10.1007/978-981-10-8228-3_55,https://doi.org/10.1007/978-981-10-8228-3_55,ISBN978-981-10-8227-6,,,,,,,,,,,,,,,,
389,B Srivani,"S. Renu Deepti, B. Srivani",No,Efficient Algorithm for Mining High Utility Itemsets from Large Datasets Using Vertical Approach,Journal,IOSR Journal of Computer Engineering (IOSR-JCE),,,"Volume 18, Issue 4, Ver. VI (Jul.-Aug. 2016), PP 68-74",2016,August,2016-17,http://www.iosrjournals.org/iosr-jce/papers/Vol18-issue4/Version-6/K1804066874.pdf,DOI: 10.9790/0661-1804066874,e-ISSN: 2278-0661,,,,,,,,,,,,,,,,
390,B Srivani,"B. Srivani , Dr. N. Sandhya and S. Renu Deepti",No,A SURVEY ON STREAM PROCESSING AND STREAMING ANALYTICS FOR REAL - TIME BIG DATA,Journal,International Journal of Latest Trends in Engineering and Technology,,,"IJLTET Special Issue- ICRACSC-2016 , pp.038-043",2016,December,2016-17,https://www.ijltet.org/journal/14997604316-SriVani-IJLTET_ICRACSC-135.pdf,https://www.ijltet.org/journal/14997604316-SriVani-IJLTET_ICRACSC-135.pdf,e-ISSN:2278-621X,,,,,,,,,,,,,,,,
391,B Srivani,"Srivani Bobba, Renu Deepti surapaneni",No,Enhancing the Security of Online Card Payment System,Journal,International Journal of Advanced Trends in Computer Science and Engineering,,,"Volume 9, Issue 2",2020,April,2019-20,http://www.warse.org/IJATCSE/static/pdf/file/ijatcse178922020.pdf,https://doi.org/10.30534/ijatcse/2020/178922020,ISSN 2278-3091,,,,,,,,,,,,,,,,
392,B Srivani,"Chalumuru Suresh, M Ravikanth, B Srivani, Thatavarti Satish",No,Cognitive IoT-based smart fitness diagnosis and recommendation system using a three-dimensional CNN with hierarchical particle swarm optimization,Book Chapter,Smart Sensors for Industrial Internet of Things,-,-,Pages 147-160 Publisher Springer Cham,,,2020-21,https://link.springer.com/chapter/10.1007/978-3-030-52624-5_10,https://doi.org/10.1007/978-3-030-52624-5_10,Print ISBN 978-3-030-52623-8,,,,,,,,,,,,,,,,
393,B Srivani,"B Srivani, N Sandhya",No,ISSUES OF BIG DATA STREAMS,Journal,International Journal of Pure and Applied Mathematics,,,"Volume 120 No. 6 2018, 3475-3486",2018,June,2017-18,https://acadpubl.eu/hub/2018-120-6/3/251.pdf,,ISSN: 1314-3395,,,,,,,,,,,,,,,,
394,B Srivani,"B Srivani, N Sandhya, B Padmaja Rani",No,A case study for performance analysis of big data stream classification using spark architecture,Journal,International Journal of System Assurance Engineering and Management,-,-,Pages 1-14 Publisher Springer India,2022,July,2022-23,https://link.springer.com/article/10.1007/s13198-022-01703-4,https://doi.org/10.1007/s13198-022-01703-4,,,,,,,,,,,,,,,,,
395,B Srivani,"S Renu Deepti B Srivani, Qualid Unnisa",Yes,Shielding Software Defined Network Using Hidden Authentication Technique,Book Chapter,Recent Trends in Intensive Computing,-,-,Volume 39 Pages 425 Publisher IOS Press,2021,December,2021-22,https://www.iospress.com/catalog/books/recent-trends-in-intensive-computing,10.3233/APC210224,ISBN print. 978-1-64368-216-7.,,,,,,,,,,,,,,,,
396,B Srivani,"B Srivani, N Sandhya, B Padmaja Rani",no,An Effective Model for Handling the Big Data Streams Based on the Optimization-Enabled Spark Framework,Book Chapter,"Book Intelligent System Design Pages 673-696 Publisher Springer, Singapore",-,-,"Advances in Intelligent Systems and Computing book series (AISC,volume 1171), pp 673–696",2020,August,2020-21,https://link.springer.com/chapter/10.1007/978-981-15-5400-1_65,https://doi.org/10.1007/978-981-15-5400-1_65,Print ISBN 978-981-15-5399-8,,,,,,,,,,,,,,,,
397,B Srivani,"B Srivani, N Sandhya, B Padmaja Rani",No,Literature review and analysis on big data stream classification techniques,jOUrnal,International Journal of Knowledge-based and Intelligent Engineering Systems,-,-,"vol. 24, no. 3, pp. 205-215, 2020",2020,September,2020-21,https://content.iospress.com/articles/international-journal-of-knowledge-based-and-intelligent-engineering-systems/kes200042,10.3233/KES-200042,"13272314, 18758827",,,,,,,,,,,,,,,,
398,B Srivani,Renu Deepti Surapaneni Srivani Bobba,No,Enhancing the Security of Online Card Payment System,Journal,International Journal of Advanced Trends in Computer Science and Engineering,,,Volume 9 Issue 2 Pages 2055-2059 Publisher WARSE,2020,April,2019-20,https://www.warse.org/IJATCSE/static/pdf/file/ijatcse178922020.pdf,https://doi.org/10.30534/ijatcse/2020/178922020,ISSN 2278-3091,,,,,,,,,,,,,,,,
399,B Srivani,"B Srivani, N Sandhya, B Padmaja Rani",No,An Effective Model for Handling the Big Data Streams Based on the Optimization-Enabled Spark Framework,Book Chapter,"Advances in Intelligent Systems and Computing book series (AISC,volume 1171)",Yes,,"Advances in Intelligent Systems and Computing book series (AISC,volume 1171)",2020,August,2020-21,https://link.springer.com/chapter/10.1007/978-981-15-5400-1_655,https://doi.org/10.1007/978-981-15-5400-1_655,Print ISBN 978-981-15-5399-8,Scopus Google Scholar,,,,,,,,,,,,,,,
400,B Srivani,"Chalumuru Suresh, M Ravikanth, B Srivani, Thatavarti Satish",No,Cognitive IoT-based smart fitness diagnosis and recommendation system using a three-dimensional CNN with hierarchical particle swarm optimization,Book Chapter,Smart Sensors for Industrial Internet of Things pp 147–160,Yes,,"Book Smart Sensors for Industrial Internet of Things Pages 147-160 Publisher Springer, Cham",2021,February,2020-21,https://link.springer.com/chapter/10.1007/978-3-030-52624-5_100,,Print ISBN 978-3-030-52623-8,Google Scholar Scopus,,,,,,,,,,,,,,,
401,B Srivani,"B. Srivani, S. Renu Deepti, Qualid Unnisa",No,Shielding Software Defined Network Using Hidden Authentication Technique,Journal,Recent Trends in Intensive Computing,-,-,Volume 39 Pages 425 Publisher IOS Press,2021,December,2021-22,https://ebooks.iospress.nl/volumearticle/58342,doi:10.3233/APC210224,,,,,,,,,,,,,,,,,
402,B Srivani,"B Srivani, N Sandhya, B Padmaja Rani",No,A case study for performance analysis of big data stream classification using spark architecture,Journal,International Journal of System Assurance Engineering and Management,Scopus,,International Journal of System Assurance Engineering and Management (2022) Pages 1-14 Publisher Springer India,2022,July,2022-23,https://link.springer.com/article/10.1007/s13198-022-01703-44,https://doi.org/10.1007/s13198-022-01703-4,,,,,,,,,,,,,,,,,
403,Illa Pavan Kumar,"Illa Pavan Kumar, Swathi Sambangi",No,Content Based Apparel Recommendation System for Fashion Industry,Journal,International Journal of Engineering and Advanced Technology (IJEAT),yes,,"Volume-8 Issue-6,August 2019 Pages 509-516",2019,August,2019-20,https://www.ijeat.org/wp-content/uploads/papers/v8i6/F7880088619.pdf,DOI: 10.35940/ijeat.F7880.088619,ISSN: 2249-8958,scopus,2,,,,,,,,,,,,,,
404,Illa Pavan Kumar,"ILLA PAVAN KUMAR, SWATHI SAMBANGI",No,Automated smart product information management through smart trolley,Journal,International Journal of Mechanical and Production Engineering Research and Development (IJMPERD),yes,,"Vol. 8, Special Issue 2, Nov 2018",2018,November,2018-19,,,ISSN: 2249-8001,scopus,0,,,,,,,,,,,,,,
405,Illa Pavan Kumar,Pavan Kumar Illa,No,Building Scalable Architectures For Web Applications in Cloud,Book,LAP LAMBERT Academic Publishing,no,,Volume 1,2016,December,2016-17,https://www.worldcat.org/title/building-scalable-architectures-for-web-applications-in-cloud/oclc/971212747,,"ISBN:9783659877773,",,0,,,,,,,,,,,,,,
406,Illa Pavan Kumar,"Illa Pavan Kumar,V. P. Hara Gopal",No,Dominant Color Palette Extraction by K-Means Clustering Algorithm and Reconstruction of Image,Book Chapter,Data Engineering and Communication Technology,yes,,"Advances in Intelligent Systems and Computing, vol 1079. Springer, Singapore pp 921-929",2020,January,2020-21,https://link.springer.com/chapter/10.1007/978-981-15-1097-7_78,DOI: https://doi.org/10.1007/978-981-15-1097-7_78,ISBN: 978-3-659-87777-3,scopus,8,,,,,,,,,,,,,,
407,Illa Pavan Kumar,"Illa Pavan Kumar, Swathi Sambangi, Ramasubbareddy Somukoa, Sravani Nalluri, K Govinda",No,Server security in cloud computing using block-chaining technique,Book Chapter,Data Engineering and Communication Technology,yes,,"dvances in Intelligent Systems and Computing, vol 1079. Springer, Singapore, Pages 913-920 Publisher Springer, Singapore",2020,January,2020-21,https://link.springer.com/chapter/10.1007/978-981-15-1097-7_77,DOI: https://doi.org/10.1007/978-981-15-1097-7_77,ISSN: 2073-607X,scopus,6,,,,,,,,,,,,,,
408,Illa Pavan Kumar,"Pavan Kumar Illa, T Senthil Kumar, F Syed Anwar Hussainy",No,Deep Learning Methods for Lung Cancer Nodule Classification: A Survey,Journal,Journal of Mobile Nultimedia,yes,,Volume 18 issue-2,2021,November,2021-22,https://journals.riverpublishers.com/index.php/JMM/article/view/7971,https://doi.org/10.13052/jmm1550-4646.18213,ISSN:1550-4646,scopus,0,,,,,,,,,,,,,,
409,Illa Pavan Kumar,"Pavan Kumar Illa, Balakesavareddy Parvathala, Anand Kumar Sharma",No,Stock price prediction methodology using random forest algorithm and support vector machine,Conference,Materials Today: Proceedings,YES,,In Press,2021,November,2021-22,https://www.sciencedirect.com/science/article/pii/S2214785321069674,https://doi.org/10.1016/j.matpr.2021.10.460,,,0,,,,,,,,,,,,,,
410,Illa Pavan Kumar,"Illa Pavan Kumar, T Senthil Kumar, Abhay Bhardwaj, Surya Prakash, Prashant K Adakane, Devvret Verma",Yes,Medical Image Classification for Disease Prediction with the AID of Machine Learning Approach,Conference,2022 2nd International Conference on Advance Computing and Innovative Technologies in Engineering (ICACITE),-,-,"Pages 1594-1598 Publisher: IEEE Conference Location: Greater Noida, India",2022,April,2021-22,https://ieeexplore.ieee.org/abstract/document/9823839,10.1109/ICACITE53722.2022.9823839,ISBN:978-1-6654-3790-5,,,,,,,,,,,,,,,,
411,Illa Pavan Kumar,"Illa Pavan Kumar, R Mahaveerakannan, K Praveen Kumar, Indranil Basu, T Ch Anil Kumar, Manasi Choche",Yes,A Design of Disease Diagnosis based Smart Healthcare Model using Deep Learning Technique,Conference,2022 International Conference on Electronics and Renewable Systems (ICEARS),-,-,Pages 1444-1449 Publisher IEEE,2022,March,2021-22,https://ieeexplore.ieee.org/abstract/document/9752063,10.1109/ICEARS53579.2022.9752063,ISBN:978-1-6654-8426-8,,,,,,,,,,,,,,,,
412,Illa Pavan Kumar,"Illa Pavan Kumar, T Senthil Kumar, Abhay Bhardwaj, Surya Prakash, Prashant K Adakane, Devvret Verma",Yes,Medical Image Classification for Disease Prediction with the AID of Machine Learning Approach,Conference,2022 2nd International Conference on Advance Computing and Innovative Technologies in Engineering (ICACITE),,,Pages 1594-1598 Publisher IEEE,2022,April,2021-22,https://ieeexplore.ieee.org/abstract/document/9823839/,DOI: 10.1109/ICACITE53722.2022.9823839,ISBN:978-1-6654-3790-5,"Scopus, Google Scholar",,,,,,,,,,,,,,,
413,Illa Pavan Kumar,"Syed Anwar Hussainy Fazlur, Senthil Kumar Thillaigovindan, Pavan Kumar Illa",No,A Survey on Deep Learning Model for Improved Disease Prediction with Multi Medical Data Sets,Conference,2022 3rd International Conference on Electronics and Sustainable Communication Systems (ICESC),No,,Pages 1530-1537 Publisher IEEE,2022,August,2022-23,https://ieeexplore.ieee.org/abstract/document/9885651,DOI: 10.1109/ICESC54411.2022.9885651,ISBN:978-1-6654-7972-1,"Scopus, Google Scholar",,,,,,,,,,,,,,,
414,Dr A Sreenivasa Rao,"Attili VenkataRamana, AnnaluriSreenivasaRao, E. Kesavulu Reddy",No,Applications of Business Intelligence and Decision Making for the Customer Behaviour Analysis in Telecom Industry,Journal,International Journal of Recent Technology and Engineering (IJRTE),,,Volume-7 Issue-6S2,2019,April,2018-19,https://www.ijrte.org/wp-content/uploads/papers/v7i6s2/F11150476S219.pdf,https://www.ijrte.org/wp-content/uploads/papers/v7i6s2/F11150476S219.pdf,ISSN: 2277-3878 (Online),,,,,,,,,,,,,,,,
415,Dr A Sreenivasa Rao,"Annaluri Sreenivasa Rao, Attili Venkata Ramana, S.Ramakrishna",No,Implementing the Data Mining Approaches to Classify the Images with Visual Words,Journal,International Journal of Recent Technology and Engineering (IJRTE),,,Volume-7 Issue-6S2,2019,April,2018-19,https://www.ijrte.org/wp-content/uploads/papers/v7i6s2/F11180476S219.pdf,https://www.ijrte.org/wp-content/uploads/papers/v7i6s2/F11180476S219.pdf,ISSN: 2277-3878,,,,,,,,,,,,,,,,
416,Dr A Sreenivasa Rao,"Prasad, K.S.N., Rao, A.S., Ramana, A.V.",No,SSFPM: Selective search based frequent pattern mining over structured data streams,Journal,Journal of Advanced Research in Dynamical and Control Systems,,,"Vol. 10, 02-Special Issue, 2018",2018,October,2018-19,https://www.jardcs.org/backissues/abstract.php?archiveid=5286,https://www.jardcs.org/backissues/abstract.php?archiveid=5286,ISSN: 1943-023X,,,,,,,,,,,,,,,,
417,Dr A Sreenivasa Rao,"Ramana, A.V., Rao, A.S., Shanmukhi, M., Madhuravani, B.",No,Utilizing data mining for appealing the frequent Item sets,Journal,journal,,,"Vol. 10, No. 10, 2018",2018,December,2018-19,https://www.jardcs.org/backissues/abstract.php?archiveid=6522,https://www.jardcs.org/backissues/abstract.php?archiveid=6522,issn:1943-023X,,,,,,,,,,,,,,,,
418,Dr A Sreenivasa Rao,"Shanmukhi, M., Venkata Ramana, A., Sreenivasa Rao, A., Madhuravani, B., Chandra Sekhar Reddy, N.",No,Big data: Query processing,Journal,Jour of Adv Research in Dynamical & Control Systems,,,"Vol. 10, 07-Special Issue, 2018,",2018,October,2018-19,https://www.jardcs.org/backissues/abstract.php?archiveid=3765,https://www.jardcs.org/backissues/abstract.php?archiveid=3765,1943-023X,,,,,,,,,,,,,,,,
419,Dr A Sreenivasa Rao,"Rao, A.S., Ramakrishna, S.",No,DCCSR: Document clustering by conceptual and semantic relevance as factors of unsupervised learning,Conferance,ACM International Conference Proceeding Series,,,International conference on advances ininformation communication technology and computing communication,2016,August,2016-17,https://dl.acm.org/doi/10.1145/2979779.2979822,https://doi.org/10.1145/2979779.2979822,ISBN: 978-1-4503-4213-1,,1,,,,,,,,,,,,,,
420,Dr A Sreenivasa Rao,"Rao, A.S., Ramakrishna, S.",No,FMODC: Fuzzy guided multi-objective document clustering by GA,Conferance,"Proceedings of the 2016 2nd International Conference on Contemporary Computing and Informatics, IC3I 2016",,,"Proceedings of the 2016 2nd International Conference on Contemporary Computing and Informatics, IC3I 2016",2016,December,2016-17,https://ieeexplore.ieee.org/document/7918043,DOI: 10.1109/IC3I.2016.7918043,ISBN:978-1-5090-5257-8,,,,,,,,,,,,,,,,
